OpenROAD 75f2f325b7a42e56a92404f33af8e96530d9b202 
This program is licensed under the BSD-3 license. See the LICENSE file for details.
Components of this program may be licensed under more restrictive licenses which must be honored.
[INFO]: Reading ODB at '/openlane/designs/dff_full_adder/runs/first_run/tmp/18-dff_full_adder.odb'…
define_corners Typical
read_liberty -corner Typical /home/mmuddassir/.volare/sky130A/libs.ref/sky130_fd_sc_hd/lib/sky130_fd_sc_hd__tt_025C_1v80.lib
Using 1e-12 for capacitance...
Using 1e+03 for resistance...
Using 1e-09 for time...
Using 1e+00 for voltage...
Using 1e-03 for current...
Using 1e-09 for power...
Using 1e-06 for distance...
Reading design constraints file at '/openlane/scripts/base.sdc'…
[INFO]: Setting output delay to: 2.0
[INFO]: Setting input delay to: 2.0
[WARNING STA-0337] port '__VIRTUAL_CLK__' not found.
[INFO]: Setting load to: 0.033442
[INFO]: Setting clock uncertainty to: 0.25
[INFO]: Setting clock transition to: 0.15
[WARNING STA-0559] transition time can not be specified for virtual clocks.
[INFO]: Setting timing derate to: 5.0 %
[INFO]: Setting signal min routing layer to: met1 and clock min routing layer to met1. 
[INFO]: Setting signal max routing layer to: met5 and clock max routing layer to met5. 
-congestion_iterations 50 -verbose -congestion_report_file /openlane/designs/dff_full_adder/runs/first_run/tmp/routing/groute-congestion.rpt
[INFO GRT-0020] Min routing layer: met1
[INFO GRT-0021] Max routing layer: met5
[INFO GRT-0022] Global adjustment: 30%
[INFO GRT-0023] Grid origin: (0, 0)
[INFO GRT-0043] No OR_DEFAULT vias defined.
[INFO GRT-0088] Layer li1     Track-Pitch = 0.4600  line-2-Via Pitch: 0.3400
[INFO GRT-0088] Layer met1    Track-Pitch = 0.3400  line-2-Via Pitch: 0.3400
[INFO GRT-0088] Layer met2    Track-Pitch = 0.4600  line-2-Via Pitch: 0.3500
[INFO GRT-0088] Layer met3    Track-Pitch = 0.6800  line-2-Via Pitch: 0.6150
[INFO GRT-0088] Layer met4    Track-Pitch = 0.9200  line-2-Via Pitch: 1.0400
[INFO GRT-0088] Layer met5    Track-Pitch = 3.4000  line-2-Via Pitch: 3.1100
[INFO GRT-0019] Found 0 clock nets.
[INFO GRT-0001] Minimum degree: 2
[INFO GRT-0002] Maximum degree: 5
[INFO GRT-0003] Macros: 0
[INFO GRT-0004] Blockages: 10

[INFO GRT-0053] Routing resources analysis:
          Routing      Original      Derated      Resource
Layer     Direction    Resources     Resources    Reduction (%)
---------------------------------------------------------------
li1        Vertical            0             0          0.00%
met1       Horizontal      59530         29490          50.46%
met2       Vertical        43233         28370          34.38%
met3       Horizontal      29728         20124          32.31%
met4       Vertical        17379         10898          37.29%
met5       Horizontal       5916          2774          53.11%
---------------------------------------------------------------

[INFO GRT-0197] Via related to pin nodes: 54
[INFO GRT-0198] Via related Steiner nodes: 0
[INFO GRT-0199] Via filling finished.
[INFO GRT-0111] Final number of vias: 61
[INFO GRT-0112] Final usage 3D: 336

[INFO GRT-0096] Final congestion report:
Layer         Resource        Demand        Usage (%)    Max H / Max V / Total Overflow
---------------------------------------------------------------------------------------
li1                  0             0            0.00%             0 /  0 /  0
met1             29490            14            0.05%             0 /  0 /  0
met2             28370           139            0.49%             0 /  0 /  0
met3             20124             0            0.00%             0 /  0 /  0
met4             10898             0            0.00%             0 /  0 /  0
met5              2774             0            0.00%             0 /  0 /  0
---------------------------------------------------------------------------------------
Total            91656           153            0.17%             0 /  0 /  0

[INFO GRT-0018] Total wirelength: 1421 um
[INFO GRT-0014] Routed nets: 18
[INFO GRT-0006] Repairing antennas, iteration 1.
[INFO GRT-0043] No OR_DEFAULT vias defined.
[INFO GRT-0012] Found 2 antenna violations.
[INFO GRT-0015] Inserted 2 diodes.
[INFO GRT-0009] rerouting 10 nets.
[INFO GRT-0001] Minimum degree: 2
[INFO GRT-0002] Maximum degree: 4
[INFO GRT-0006] Repairing antennas, iteration 2.
[INFO GRT-0043] No OR_DEFAULT vias defined.
[INFO GRT-0012] Found 0 antenna violations.
Placement Analysis
---------------------------------
total displacement          0.0 u
average displacement        0.0 u
max displacement            0.0 u
original HPWL            1185.1 u
legalized HPWL           1186.0 u
delta HPWL                    0 %

[INFO DPL-0020] Mirrored 4 instances
[INFO DPL-0021] HPWL before            1186.0 u
[INFO DPL-0022] HPWL after             1182.9 u
[INFO DPL-0023] HPWL delta               -0.3 %
[INFO]: Setting signal min routing layer to: met1 and clock min routing layer to met1. 
[INFO]: Setting signal max routing layer to: met5 and clock max routing layer to met5. 
-congestion_iterations 50 -verbose -congestion_report_file /openlane/designs/dff_full_adder/runs/first_run/tmp/routing/groute-congestion.rpt
[INFO GRT-0020] Min routing layer: met1
[INFO GRT-0021] Max routing layer: met5
[INFO GRT-0022] Global adjustment: 30%
[INFO GRT-0023] Grid origin: (0, 0)
[INFO GRT-0043] No OR_DEFAULT vias defined.
[INFO GRT-0088] Layer li1     Track-Pitch = 0.4600  line-2-Via Pitch: 0.3400
[INFO GRT-0088] Layer met1    Track-Pitch = 0.3400  line-2-Via Pitch: 0.3400
[INFO GRT-0088] Layer met2    Track-Pitch = 0.4600  line-2-Via Pitch: 0.3500
[INFO GRT-0088] Layer met3    Track-Pitch = 0.6800  line-2-Via Pitch: 0.6150
[INFO GRT-0088] Layer met4    Track-Pitch = 0.9200  line-2-Via Pitch: 1.0400
[INFO GRT-0088] Layer met5    Track-Pitch = 3.4000  line-2-Via Pitch: 3.1100
[INFO GRT-0019] Found 0 clock nets.
[INFO GRT-0001] Minimum degree: 2
[INFO GRT-0002] Maximum degree: 5
[INFO GRT-0003] Macros: 0
[INFO GRT-0004] Blockages: 10

[INFO GRT-0053] Routing resources analysis:
          Routing      Original      Derated      Resource
Layer     Direction    Resources     Resources    Reduction (%)
---------------------------------------------------------------
li1        Vertical            0             0          0.00%
met1       Horizontal      59530         29490          50.46%
met2       Vertical        43233         28370          34.38%
met3       Horizontal      29728         20124          32.31%
met4       Vertical        17379         10898          37.29%
met5       Horizontal       5916          2774          53.11%
---------------------------------------------------------------

[INFO GRT-0197] Via related to pin nodes: 55
[INFO GRT-0198] Via related Steiner nodes: 0
[INFO GRT-0199] Via filling finished.
[INFO GRT-0111] Final number of vias: 62
[INFO GRT-0112] Final usage 3D: 340

[INFO GRT-0096] Final congestion report:
Layer         Resource        Demand        Usage (%)    Max H / Max V / Total Overflow
---------------------------------------------------------------------------------------
li1                  0             0            0.00%             0 /  0 /  0
met1             29490            15            0.05%             0 /  0 /  0
met2             28370           139            0.49%             0 /  0 /  0
met3             20124             0            0.00%             0 /  0 /  0
met4             10898             0            0.00%             0 /  0 /  0
met5              2774             0            0.00%             0 /  0 /  0
---------------------------------------------------------------------------------------
Total            91656           154            0.17%             0 /  0 /  0

[INFO GRT-0018] Total wirelength: 1435 um
[INFO GRT-0014] Routed nets: 18
Setting global connections for newly added cells…
Writing OpenROAD database to '/openlane/designs/dff_full_adder/runs/first_run/tmp/routing/20-global.odb'…
Writing layout to '/openlane/designs/dff_full_adder/runs/first_run/tmp/routing/20-global.def'…
Writing routing guides to '/openlane/designs/dff_full_adder/runs/first_run/tmp/routing/20-global.guide'…
