OpenROAD 75f2f325b7a42e56a92404f33af8e96530d9b202 
This program is licensed under the BSD-3 license. See the LICENSE file for details.
Components of this program may be licensed under more restrictive licenses which must be honored.
[INFO]: Reading ODB at '/openlane/designs/dff_full_adder/runs/first_run/tmp/routing/23-fill.odb'…
define_corners Typical
read_liberty -corner Typical /home/mmuddassir/.volare/sky130A/libs.ref/sky130_fd_sc_hd/lib/sky130_fd_sc_hd__tt_025C_1v80.lib
Using 1e-12 for capacitance...
Using 1e+03 for resistance...
Using 1e-09 for time...
Using 1e+00 for voltage...
Using 1e-03 for current...
Using 1e-09 for power...
Using 1e-06 for distance...
Reading design constraints file at '/openlane/scripts/base.sdc'…
[INFO]: Setting output delay to: 2.0
[INFO]: Setting input delay to: 2.0
[WARNING STA-0337] port '__VIRTUAL_CLK__' not found.
[INFO]: Setting load to: 0.033442
[INFO]: Setting clock uncertainty to: 0.25
[INFO]: Setting clock transition to: 0.15
[WARNING STA-0559] transition time can not be specified for virtual clocks.
[INFO]: Setting timing derate to: 5.0 %
[INFO ORD-0030] Using 2 thread(s).
[INFO DRT-0149] Reading tech and libs.

Units:                1000
Number of layers:     13
Number of macros:     441
Number of vias:       25
Number of viarulegen: 25

[INFO DRT-0150] Reading design.

Design:                   dff_full_adder
Die area:                 ( 0 0 ) ( 516255 274370 )
Number of track patterns: 12
Number of DEF vias:       0
Number of components:     12846
Number of terminals:      10
Number of snets:          2
Number of nets:           18

[INFO DRT-0167] List of default vias:
  Layer via
    default via: M1M2_PR
  Layer via2
    default via: M2M3_PR
  Layer via3
    default via: M3M4_PR
  Layer via4
    default via: M4M5_PR
[INFO DRT-0162] Library cell analysis.
[INFO DRT-0163] Instance analysis.
  Complete 10000 instances.
[INFO DRT-0164] Number of unique instances = 32.
[INFO DRT-0168] Init region query.
[INFO DRT-0018]   Complete 10000 insts.
[INFO DRT-0024]   Complete FR_MASTERSLICE.
[INFO DRT-0024]   Complete Fr_VIA.
[INFO DRT-0024]   Complete li1.
[INFO DRT-0024]   Complete mcon.
[INFO DRT-0024]   Complete met1.
[INFO DRT-0024]   Complete via.
[INFO DRT-0024]   Complete met2.
[INFO DRT-0024]   Complete via2.
[INFO DRT-0024]   Complete met3.
[INFO DRT-0024]   Complete via3.
[INFO DRT-0024]   Complete met4.
[INFO DRT-0024]   Complete via4.
[INFO DRT-0024]   Complete met5.
[INFO DRT-0033] FR_MASTERSLICE shape region query size = 0.
[INFO DRT-0033] FR_VIA shape region query size = 0.
[INFO DRT-0033] li1 shape region query size = 66473.
[INFO DRT-0033] mcon shape region query size = 202038.
[INFO DRT-0033] met1 shape region query size = 26173.
[INFO DRT-0033] via shape region query size = 1860.
[INFO DRT-0033] met2 shape region query size = 1124.
[INFO DRT-0033] via2 shape region query size = 1488.
[INFO DRT-0033] met3 shape region query size = 1116.
[INFO DRT-0033] via3 shape region query size = 1488.
[INFO DRT-0033] met4 shape region query size = 404.
[INFO DRT-0033] via4 shape region query size = 16.
[INFO DRT-0033] met5 shape region query size = 24.
[INFO DRT-0165] Start pin access.
[INFO DRT-0078]   Complete 32 pins.
[INFO DRT-0081]   Complete 14 unique inst patterns.
[INFO DRT-0084]   Complete 15 groups.
#scanned instances     = 12846
#unique  instances     = 32
#stdCellGenAp          = 294
#stdCellValidPlanarAp  = 9
#stdCellValidViaAp     = 221
#stdCellPinNoAp        = 0
#stdCellPinCnt         = 36
#instTermValidViaApCnt = 0
#macroGenAp            = 0
#macroValidPlanarAp    = 0
#macroValidViaAp       = 0
#macroNoAp             = 0
[INFO DRT-0166] Complete pin access.
[INFO DRT-0267] cpu time = 00:00:02, elapsed time = 00:00:01, memory = 135.39 (MB), peak = 140.05 (MB)

Number of guides:     95

[INFO DRT-0169] Post process guides.
[INFO DRT-0176] GCELLGRID X 0 DO 74 STEP 6900 ;
[INFO DRT-0177] GCELLGRID Y 0 DO 39 STEP 6900 ;
[INFO DRT-0028]   Complete FR_MASTERSLICE.
[INFO DRT-0028]   Complete Fr_VIA.
[INFO DRT-0028]   Complete li1.
[INFO DRT-0028]   Complete mcon.
[INFO DRT-0028]   Complete met1.
[INFO DRT-0028]   Complete via.
[INFO DRT-0028]   Complete met2.
[INFO DRT-0028]   Complete via2.
[INFO DRT-0028]   Complete met3.
[INFO DRT-0028]   Complete via3.
[INFO DRT-0028]   Complete met4.
[INFO DRT-0028]   Complete via4.
[INFO DRT-0028]   Complete met5.
[INFO DRT-0178] Init guide query.
[INFO DRT-0035]   Complete FR_MASTERSLICE (guide).
[INFO DRT-0035]   Complete Fr_VIA (guide).
[INFO DRT-0035]   Complete li1 (guide).
[INFO DRT-0035]   Complete mcon (guide).
[INFO DRT-0035]   Complete met1 (guide).
[INFO DRT-0035]   Complete via (guide).
[INFO DRT-0035]   Complete met2 (guide).
[INFO DRT-0035]   Complete via2 (guide).
[INFO DRT-0035]   Complete met3 (guide).
[INFO DRT-0035]   Complete via3 (guide).
[INFO DRT-0035]   Complete met4 (guide).
[INFO DRT-0035]   Complete via4 (guide).
[INFO DRT-0035]   Complete met5 (guide).
[INFO DRT-0036] FR_MASTERSLICE guide region query size = 0.
[INFO DRT-0036] FR_VIA guide region query size = 0.
[INFO DRT-0036] li1 guide region query size = 34.
[INFO DRT-0036] mcon guide region query size = 0.
[INFO DRT-0036] met1 guide region query size = 29.
[INFO DRT-0036] via guide region query size = 0.
[INFO DRT-0036] met2 guide region query size = 19.
[INFO DRT-0036] via2 guide region query size = 0.
[INFO DRT-0036] met3 guide region query size = 0.
[INFO DRT-0036] via3 guide region query size = 0.
[INFO DRT-0036] met4 guide region query size = 0.
[INFO DRT-0036] via4 guide region query size = 0.
[INFO DRT-0036] met5 guide region query size = 0.
[INFO DRT-0179] Init gr pin query.
[INFO DRT-0245] skipped writing guide updates to database.
[INFO DRT-0185] Post process initialize RPin region query.
[INFO DRT-0181] Start track assignment.
[INFO DRT-0184] Done with 53 vertical wires in 2 frboxes and 29 horizontal wires in 1 frboxes.
[INFO DRT-0186] Done with 2 vertical wires in 2 frboxes and 7 horizontal wires in 1 frboxes.
[INFO DRT-0182] Complete track assignment.
[INFO DRT-0267] cpu time = 00:00:01, elapsed time = 00:00:00, memory = 150.88 (MB), peak = 165.32 (MB)
[INFO DRT-0187] Start routing data preparation.
[INFO DRT-0267] cpu time = 00:00:00, elapsed time = 00:00:00, memory = 151.07 (MB), peak = 165.32 (MB)
[INFO DRT-0194] Start detail routing.
[INFO DRT-0195] Start 0th optimization iteration.
    Completing 10% with 0 violations.
    elapsed time = 00:00:00, memory = 151.07 (MB).
    Completing 20% with 0 violations.
    elapsed time = 00:00:00, memory = 151.32 (MB).
    Completing 30% with 0 violations.
    elapsed time = 00:00:00, memory = 151.32 (MB).
    Completing 40% with 0 violations.
    elapsed time = 00:00:00, memory = 151.41 (MB).
    Completing 50% with 0 violations.
    elapsed time = 00:00:00, memory = 151.42 (MB).
    Completing 60% with 0 violations.
    elapsed time = 00:00:00, memory = 151.42 (MB).
    Completing 70% with 0 violations.
    elapsed time = 00:00:00, memory = 156.09 (MB).
    Completing 80% with 0 violations.
    elapsed time = 00:00:00, memory = 157.45 (MB).
    Completing 90% with 0 violations.
    elapsed time = 00:00:00, memory = 157.45 (MB).
    Completing 100% with 0 violations.
    elapsed time = 00:00:00, memory = 159.16 (MB).
[INFO DRT-0199]   Number of violations = 0.
[INFO DRT-0267] cpu time = 00:00:01, elapsed time = 00:00:00, memory = 161.41 (MB), peak = 509.07 (MB)
Total wire length = 1161 um.
Total wire length on LAYER li1 = 0 um.
Total wire length on LAYER met1 = 86 um.
Total wire length on LAYER met2 = 1075 um.
Total wire length on LAYER met3 = 0 um.
Total wire length on LAYER met4 = 0 um.
Total wire length on LAYER met5 = 0 um.
Total number of vias = 71.
Up-via summary (total 71):.

---------------------
 FR_MASTERSLICE     0
            li1    36
           met1    35
           met2     0
           met3     0
           met4     0
---------------------
                   71


[INFO DRT-0198] Complete detail routing.
Total wire length = 1161 um.
Total wire length on LAYER li1 = 0 um.
Total wire length on LAYER met1 = 86 um.
Total wire length on LAYER met2 = 1075 um.
Total wire length on LAYER met3 = 0 um.
Total wire length on LAYER met4 = 0 um.
Total wire length on LAYER met5 = 0 um.
Total number of vias = 71.
Up-via summary (total 71):.

---------------------
 FR_MASTERSLICE     0
            li1    36
           met1    35
           met2     0
           met3     0
           met4     0
---------------------
                   71


[INFO DRT-0267] cpu time = 00:00:01, elapsed time = 00:00:01, memory = 161.41 (MB), peak = 509.07 (MB)

[INFO DRT-0180] Post processing.
Setting global connections for newly added cells…
Writing OpenROAD database to '/openlane/designs/dff_full_adder/runs/first_run/results/routing/dff_full_adder.odb'…
Writing netlist to '/openlane/designs/dff_full_adder/runs/first_run/results/routing/dff_full_adder.nl.v'…
Writing powered netlist to '/openlane/designs/dff_full_adder/runs/first_run/results/routing/dff_full_adder.pnl.v'…
Writing layout to '/openlane/designs/dff_full_adder/runs/first_run/results/routing/dff_full_adder.def'…
